Product_name,by_info,Product_img,Product_price,rating,total_review,ans_ask,prod_des,feature
"Xifo Life Plus S (4G Volte 3 GB RAM , 32 GB ROM)",Xifo,https://images-na.ssl-images-amazon.com/images/I/71e2fLDaWCL._SL1500_.jpg,3949,3.2,2000 customer reviews,500+ answered questions ,"Stay connected with the STK Life Plus S Smartphone This ultra-smart device has everything you need to make day to day life a breeze. Using the seamless Android 7.0 Nougat operating system, access all of your important apps, photos and files with the touch of a button, with viewing improved, thanks to a 5.5in HD screen and 2.5D glass and incredible 32GB expandable internal memory, so you never need to worry about space. Enjoy 4G on the go for enriched connectivity, GPS and AGPS for a greater navigation experience and get snap-happy with the 8MP rear camera, with integrated autofocus and flash for quality photos to remember every special moment. 5MP Front camera for fun selfies. 4G Enabled for faster, seamless connectivity / Bluetooth V4.0 / WiFi enabled Android 7.0 Nougat OS. Unlocked to any network, you can also make the most of this smartphones dual SIM technology, perfect for taking on holiday or for home to balance personal and business life.","4G VoLTE Support mobile phone5.5-inch HD Display,1920x1080 Pixels8 MP Rear camera with LED flash and 5 MP camera with flash. 3 GB RAM, 32 GB internal storage and expandable with hybrid microSD card slot upto 32 GB Android 7.0 Nougat operating system 2800 mAh removable battery"
"Samsung Galaxy M20 (Ocean Blue, 3+32GB)",Samsung,https://images-na.ssl-images-amazon.com/images/I/61nzw1i2taL._SL1500_.jpg,11447,3.9,"31,793 customer reviews",1000+ answered questions,"The Samsung Galaxy M20 is especially created for the millennials who live on the edge and do not compromise on anything. With a beautiful infinity V-cut display, a wide angle camera, a huge battery with faster charging and a powerful processor along with the trust that comes with brand Samsung, the Galaxy M20 is a powerful smartphone. Toll Free No:1 800 40 7267864","13MP+5MP ultra-wide dual camera | 8MP f2.0 front camera16cm (6.3"") Full HD+ Infinity V Display with 2340x1080 crystal clear resolution (409 PPI)5000 mAh battery with 3x fast charge | 15W Type-C fast charger in the box3GB RAM and 32GB internal memory expandable up to 512GB in a dedicated slotFast face unlock and fingerprint sensor | Dual SIM (nano+nano) with dual standby and dual VoLTEWidevine L1 certification for HD streaming | Dolby ATMOS 360 surround sound1.8GHz Exynos 7904 octa-core processor | Android Oreo v8.1 OS1 year manufacturer warranty for device and 6 months manufacturer warranty for in-box accessories including batteries from the date of purchase.For any product related queries contact : 1800 5 7267864"
"Samsung On7 Pro (Gold, 2GB RAM, 16GB Storage)",Samsung,https://images-na.ssl-images-amazon.com/images/I/81mKtZOvUmL._SL1500_.jpg,6200,3.8,"16,787 customer reviews",1000+ answered questions,"With LTE Cat 4 support, you can download HD movies, enjoy web browsing and music streaming, all at lightening-quick speeds. Experience seamless network connectivity via speedy Wi-Fi connection. Bluetooth-enabled to allow you to pair it with a headset, tablet or other device.","Camera: 13 MP Rear camera with Auto mode, Beauty face, Continuous shot, Interval shot, Panorama mode | 5 MP front camera with Palm gesture selfie and 120 Degree selfie modeDisplay: 13.86 centimeters (5.5-inch) HD TFT capacitive touchscreen display with 720x1280 pixelsMemory, Storage & SIM: 2GB RAM | 16GB storage expandable up to 128GB | Dual micro SIM with dual standby (4G+4G)Operating System and Processor: Android v6.0 Marshmallow operating system with 1.2GHz Qualcomm Snapdragon quad core processorBattery: 3000 mAH lithium ion battery. Internet Usage Time(3G)-Up to 10 hrs. Internet Usage Time(LTE)-Up to 12 hrs. Internet Usage Time(Wi-Fi)-Up to 14 hrs. Video Playback Time-Up to 12hrs. Audio Playback Time-Up to 78 hrsWarranty: 1 year manufacturer warranty for device and 6 months manufacturer warranty for in-box accessories including batteries from the date of purchaseIncluded in box: Travel adaptor, USB Cable (Earphones to be purchased separately)For product related assistance contact_us on: [ 1800407267864 ]"
"Honor 9 Lite (Grey, 4GB RAM, 64GB Storage)",Honor,https://images-na.ssl-images-amazon.com/images/I/81BveOlcc%2BL._SL1500_.jpg,16999,3.8,93 customer reviews,139 answered questions,"Take phone-photography to the next level with the Honor 9 Lite. Equipped with a dual camera system on, both, front and rear and a Full View FHD+ display, this smartphone not only lets you capture life's best moments but it also lets you see them in a picture-perfect clarity.","13MP+2MP dual camera and 13MP +2MP front facing camera14.35 centimeters (5.65-inch) multi-touch capacitive touchscreen with 2160 x 1080 pixels resolution 16M color supportMemory, Storage & SIM: 4GB RAM | 64GB storage expandable up to 256GB| Dual SIM with dual standby (4G+4G)Android v8 Oreo operating system with 2.36GHz + 1.7GHz Kirin 659 octa core processor3000mAH lithium-polymer battery1 year manufacturer warranty for device and 6 months manufacturer warranty for in-box accessories including batteries from the date of purchaseBox also includes: Charger, USB Cable, Quick Start Guide, Warranty Card, Eject Tool, Protective Case"
"Redmi 6 (Blue, 3GB RAM, 64GB Storage)",Mi,https://seller.shoponn.in/Item/Redmi 6 Blue 64 GB 3 GB RAM A.jpg,8499,4,"1,107 customer reviews",559 answered questions,"Take strikingly clear photos with the 12MP + 5MP AI dual camera. 1.25μm large pixels on the primary lens capture the beauty of any scene, while the AI-powered portrait mode with Beautify blurs the background to create portraits that stand out. The octa-core processor takes operational efficiency to the next level which results in brilliant performance.","12MP+5MP dual rear camera with LED selfie flash | 5MP front facing camera13.84 centimeters (5.45-inch) multi-touch capacitive touchscreen with 1440 x 720 pixels resolutionMemory, Storage & SIM: 3GB RAM | 64GB internal memory expandable up to 256GB | Dual SIM (nano+nano) dual-standby (4G+4G)Android Oreo v8.1 operating system with 2GHz Mediatek P22 octa core processor3000mAH lithium-polymer battery1 year manufacturer warranty for device and 6 months manufacturer warranty for in-box accessories including batteries from the date of purchaseBox also Includes: Power Adapter, USB cable, SIM Eject Tool, Warranty Card and User Guide"
"Surya Tashan TS455 ( 2 GB RAM , 16 GB ROM)",Surya,https://images-na.ssl-images-amazon.com/images/I/71OkPtAQ1SL._SL1500_.jpg,2970,2.7,500 customer reviews,50+ answered questions,"Tashan 5 inch Mobile 4G (VoLte Not Supported) phone comes with a 5.0 inch touchscreen display with a resolution of 710 pixels by 1344 pixels at a PPI of 401 pixels per inch. The Tashan Model 4G is powered by 1.0 GHz Dual core Mediatek processor and it comes with 2 GB of RAM. The phone packs 16 GB of internal storage that cannot be expanded upto 31 GB. As far as the cameras are concerned, the Tashan Model 4G packs a 5 Megapixel primary camera on the rear 5 MP Front Camera. The Tashan Model 4G runs Android Naugot 7.0 and is powered by a 2200 mAh removable battery. It measures 144mmx71mmx8.5mm and weight 150.00 grams. The Tashan Model 4G is a dual SIM (GSM and GSM) smartphone that accepts Micro-SIM and Micro-SIM. Connectivity options include Wi-Fi, GPS, Bluetooth, NFC, USB OTG, FM, 3G and 4G. Sensors on the phone include Compass Magnetometer, Proximity sensor, Accelerometer, Ambient light sensor and Gyroscope","5.0 inch Full HD IPS Display, 2.5D curved glass, 1920x1080 Pixels2 GB RAM, 16 GB internal storage expandable with hybrid microSD card slot1.0 Dual Core MediaTek processor Android Naugot 7.0It Comes With Single rear camera of 5 Mpix, Other camera is Decorative not the real Camera only to give Smartphone a rich and elegant Look. It also has a Single Front Camera of 5 Mpix.Battery Capacity 2200 mAh removable Battery without fingerprint scanner"
"Realme U1 (Ambitious Black, 3GB RAM, 32GB Storage)",realme,https://images-na.ssl-images-amazon.com/images/I/61K56dRy-2L._SL1500_.jpg,9999,4.4,"16,729 customer reviews",1000+ answered questions,"U1, Realme best selfie camera ever with Sony IMX576 sensor. AI 25MP, India's selfie pro. World 1st smartphone with Helio P70, packing a 6.3-inch FHD+ Dewdrop screen in fiery gold, ambitious black, brave blue. Backed by thorough localized testing to enhance Indian natural beauty features for stunning selfies, including skin tone, eye shape, and more.","13MP+2MP dual rear camera | 25MP front camera16.002 centimeters (6.3-inch) FHD+ multi-touch capacitive touchscreen with 2340 x 1080 pixels resolution, 409 ppi pixel densityMemory, Storage and SIM: 3GB | 32GB internal memory expandable up to 256GB | Dual SIM (nano+nano) dual-standby (4G+4G)Android v8.1 Oreo based on Funtouch OS 5.2 operating system with 2.1GHz MediaTek Helio P70 octa core processor3500mAH lithium-ion battery1 year manufacturer warranty for device and 6 months manufacturer warranty for in-box accessories including batteries from the date of purchase"
"Samsung Galaxy M20 (Charcoal Black, 4+64GB)",Samsung,https://images-na.ssl-images-amazon.com/images/I/71rFOsegqqL._SL1500_.jpg,11447,3.9,"31,795 customer reviews",1000+ answered questions,"The Samsung Galaxy M20 is especially created for the millennials who live on the edge and do not compromise on anything. With a beautiful infinity V-cut display, a wide angle camera, a huge battery with faster charging and a powerful processor along with the trust that comes with brand Samsung, the Galaxy M20 is a powerful smartphone. Toll Free No:1 800 40 7267864","13MP+5MP ultra-wide dual camera | 8MP f2.0 front camera16cm (6.3"") Full HD+ Infinity V Display with 2340x1080 crystal clear resolution (409 PPI)5000 mAh battery with 3x fast charge | 15W Type-C fast charger in the box4GB RAM and 64GB internal memory expandable up to 512GB in a dedicated slotFast face unlock and fingerprint sensor | Dual SIM (nano+nano) with dual standby and dual VoLTEWidevine L1 certification for HD streaming | Dolby ATMOS 360 surround sound1.8GHz Exynos 7904 octa-core processor | Android Oreo v8.1 OS1 year manufacturer warranty for device and 6 months manufacturer warranty for in-box accessories including batteries from the date of purchase,For any product related queries contact : 1800 5 7267864"
"Panasonic P85 NXT (Blue, 2GB RAM, 16GB Storage)",Panasonic,https://images-na.ssl-images-amazon.com/images/I/71TrDwir68L._SL1500_.jpg,4990,3.1,144 customer reviews,127 answered questions,"Panasonic P85 NXT is a 2GB RAM, powered by a Snapdragon processor and runs on a 4000 Mah battery. It comes with Face unlock and finger print sensor.","8MP primary camera | 5MP front facing camera12.7 centimeters (5-inch) with 1280 x 720 pixels resolutionMemory, Storage & SIM: 2GB RAM | 16GB storage expandable up to 128GB | Dual SIM with dual standby (4G+4G)Android v7 Nougat operating system with 1.3GHz Snapdragon 210 quad core processor4000mAH lithium-ion battery1 year manufacturer warranty for device and 6 months manufacturer warranty for in-box accessories including batteries from the date of purchase"
"Redmi 6A (Blue, 2GB RAM, 32GB Storage)",Redmi,https://images-na.ssl-images-amazon.com/images/I/71IhX7fJbzL._SL1500_.jpg,"6,999",4.1,"1,994 customer reviews",189 answered questions,"Mediatek helio A22, 2.0 GHz quad core processor, 3000mAh battery capacity, 13.84 cm (5.45"") HD plus display, 2GB plus 32GB flash memory, android Oreo 8.1 with MIUI 9.6, 13 MP rear camera with PDAF, HDR, flash, 5 MP front camera with portrait mode, proximity sensor, E compass, accelerometer.","Camera: 13 MP Rear camera | 5 MP front cameraDisplay: 13.84 centimetres (5.45-inch) HD+ display with 1440x720 pixels, 295 pixel density and 18:9 aspect ratioMemory, Storage & SIM: 2GB RAM | 32GB storage expandable up to 256GB with dedicated slot | Dual nano SIM with dual-standby (4G+4G)Operating System and Processor: Android v8.1 operating system with Mediatek Helio A22, 2.0Ghz Quad core processor with 12nm technologyBattery: 3000 mAH lithium Polymer batteryWarranty: 1 year manufacturer warranty for device and 6 months manufacturer warranty for in-box accessories including batteries from the date of purchaseIncluded in box: Adapter, USB Cable"
